movie_id,movie_image,movie_title,genres,country,director,duration,movie_year,actors,description,action_link,movie_link,episode_links
1,https://cdn.upmovies.net/MV5BNWMxZTRkZjgtNmE5My00ODlkLWI1NDAtOTU5YTk4NTcwNjYxXkEyXkFqcGdeQXVyMTQxNzMzNDI@._V1_SX300.jpg,Totally F***ed Up,"Comedy, Drama, Romance",United States,Gregg Araki,78 min,1993.0,"James Duval, Roko Belic, Susan Behshid, Jenee Gill",Six queer teenagers struggle to get along with each other and with life in the face of varying obstacles.,https://upmovies.net/watch/gdVVPDpd-totally-f-ed-up.html,https://eplayvid.net/watch/4cf52fb6ada05da,
2,https://cdn.upmovies.net/MV5BMTgxMTk3MzA3N15BMl5BanBnXkFtZTgwODI5NTAwNzE@._V1_SX300.jpg,F.A.R.T. The Movie,Comedy,USA,Ray Etheridge,91 min,1991.0,"Joel Weiss, Shannandoah Sorin, Jeff Olsen, Issac Clay","Russell has two passions: watching television and farting! He also loves Heather. Heather HATES farting. The eternal triangle! One day she warns him, ""if they ever allow farting on ...",https://upmovies.net/watch/gdVnPK8d-f-a-r-t-the-movie.html,https://eplayvid.net/watch/150263b285da712,
3,https://cdn.upmovies.net/MV5BMjE0MDcyODAyN15BMl5BanBnXkFtZTgwNjE0OTQ4MzE@._V1_SX300.jpg,The F.b.i. Files: Season 1,"Documentary, Biography, Crime",United States,,60 min,1998.0,"James Kallstrom, Anthony D. Call",,https://upmovies.net/watch/rdmjqgvX-the-f-b-i-files-season-1.html,https://eplayvid.net/watch/fb01d41e0e2f778,"https://eplayvid.net/watch/fb01d41e0e2f778, https://eplayvid.net/watch/69e1994fed0363f, https://eplayvid.net/watch/189f5fb8e11a2cd, https://eplayvid.net/watch/2378074fafe5fa7, https://eplayvid.net/watch/3a7a9c26ce4fc50, https://eplayvid.net/watch/8d84ed6925cdc74, https://eplayvid.net/watch/02232f67004d46a, https://eplayvid.net/watch/b239590f808a364, https://eplayvid.net/watch/39703ea6f138c43, https://eplayvid.net/watch/ad669fbb6e840c5, https://eplayvid.net/watch/3fa5366310d0ab1, https://eplayvid.net/watch/aa4bc787769c438, https://eplayvid.net/watch/8670e7911a9619c"
4,https://cdn.upmovies.net/MV5BMTU4MTk0NjU3N15BMl5BanBnXkFtZTcwMzQxMTE3NA@@._V1_SX300.jpg,S.f.w.,"Comedy, Drama",United States,Jefery Levy,96 min,1994.0,"Stephen Dorff, Reese Witherspoon, Jake Busey, Joey Lauren Adams",An alienated and misanthropic teenager gains sudden and unwanted celebrity status after he's taken hostage by terrorists where his indifference to their threats to kill him makes news headlines.,https://upmovies.net/watch/JdAQVydL-s-f-w.html,https://eplayvid.net/watch/12f907c1254aeed,
5,https://cdn.upmovies.net/MV5BMTI4NzM4MzA0MF5BMl5BanBnXkFtZTcwNzAzOTQyMQ@@._V1_SX300.jpg,F.t.w.,"Crime, Drama, Romance",United States,Michael Karbelnikoff,100 min,1994.0,"Mickey Rourke, Aaron Neville, Peter Berg, Lori Singer","Frank T. Wells has just been released from prison after serving a term for manslaughter. Frank's a reasonably honest man and a good rodeo rider. When he meets up with Scarlett, a bank ...",https://upmovies.net/watch/eGLAw6dV-f-t-w.html,https://eplayvid.net/watch/4afab6705f8bb16,
6,https://cdn.upmovies.net/MV5BMjA2MzAxODMwOF5BMl5BanBnXkFtZTcwNDY1MDY2NA@@._V1_SX300.jpg,F/x2,"Action, Thriller",United States,Richard Franklin,108 min,1991.0,"Bryan Brown, Brian Dennehy, Rachel Ticotin, Joanna Gleason","F/X man Rollie Tyler (Bryan Brown) is now a toy maker. Mike Brandon (Tom Mason), the ex-husband of Rolly's girlfriend Kim(Rachel Ticotin), is a cop. He asks Rollie to help catch a killer. ...",https://upmovies.net/watch/mxy5zQxN-f-x2.html,https://eplayvid.net/watch/6ee00f2e6531563,
7,https://cdn.upmovies.net/MV5BMjY4NjYwNTYzM15BMl5BanBnXkFtZTcwMjQ0MzkzMQ@@._V1_SX300.jpg,In The Line Of Duty: The F.b.i. Murders,"Action, Crime, Drama, Thriller",United States,Dick Lowry,92 min,1988.0,"Ronny Cox, Bruce Greenwood, Michael Gross, Doug Sheehan","Florida 1985: A series of brutal robberies and murders keeps the F.B.I busy. Although all crimes seem to be comitted by the same group, they can't hunt them down. The experienced officer ...",https://upmovies.net/watch/bxqpkVAv-in-the-line-of-duty-the-f-b-i-murders.html,https://eplayvid.net/watch/a3949e118078e26,
8,https://cdn.upmovies.net/MV5BMTA1NTUxMjA4NjleQTJeQWpwZ15BbWU3MDY2NTA2NjQ@._V1_SX300.jpg,F/x,"Action, Thriller",United States,Robert Mandel,109 min,1986.0,"Bryan Brown, Brian Dennehy, Diane Venora, Cliff De Young","A movie special effects man is hired to fake a real-life mob killing for a witness protection plan, but finds his own life in danger.",https://upmovies.net/watch/0v8KbWdw-f-x.html,https://eplayvid.net/watch/abea3a771b10ac4,
9,https://cdn.upmovies.net/MV5BNTc3ZDhlMWItZDFhZS00YTIzLTk4NTMtNDAyZDMzNzE2MDllXkEyXkFqcGdeQXVyMjUzOTY1NTc@._V1_SX300.jpg,Christiane F.,"Biography, Drama",West Germany,Uli Edel,138 min,1981.0,"Natja Brunckhorst, Eberhard Auriga, Peggy Bussieck",A teen girl in 1970s Berlin becomes addicted to heroin. Everything in her life slowly begins to distort and disappear as she befriends a small crew of junkies and falls in love with a drug-abusing male prostitute.,https://upmovies.net/watch/qd7lNrov-christiane-f.html,https://eplayvid.net/watch/b6e57c5b592632e,
10,https://i932.photobucket.com/albums/ad163/postermovie/ChristianeFWirKindervomBahnhofZoo1981_zpsa23ac413.jpg,Christiane F. - Wir Kinder Vom Bahnhof Zoo,"Biography, Drama",West Germany,Uli Edel       (as Ulrich Edel),138 min,1981.0,"Natja Brunckhorst, Eberhard Auriga, Peggy Bussieck","This movie portrays the drug scene in Berlin in the 1970s, following tape recordings of Christiane F. 14-year-old Christiane lives with her mother and little sister in a typical multi-story apartment building in Berlin. She's fascinated by 'The Sound', a new disco with the most modern equipment. Although legally she's too young, she asks a friend to take her. There, she meets Detlef, who's in a clique where everybody's on drugs. Step by step she gets drawn deeper into the scene...",https://upmovies.net/watch/Ed95KgdY-christiane-f-wir-kinder-vom-bahnhof-zoo.html,https://eplayvid.net/watch/fc6aa63af9d69b7,
11,https://cdn.upmovies.net/MV5BNWIzY2IyY2UtZjAxYy00NzAyLTkwMzYtMmVmZWMyYjQwMWZkXkEyXkFqcGdeQXVyMjMwNDgzNjc@._V1_SX300.jpg,F.i.s.t,"Crime, Drama, Thriller",United States,Norman Jewison,145 min,1978.0,"Sylvester Stallone, Rod Steiger, Peter Boyle",A rebellious Cleveland warehouse worker rises through the ranks of a trucking industry union to become union president but his organized crime links cause his eventual downfall.,https://upmovies.net/watch/zdKoB4rd-f-i-s-t.html,https://eplayvid.net/watch/2f0319777708349,
12,https://cdn.upmovies.net/MV5BMTM1Nzk4ODE3M15BMl5BanBnXkFtZTcwNjUwODYzNA@@._V1_SX300.jpg,F.i.s.t.,"Crime, Drama, Thriller",United States,Norman Jewison,145 min,1978.0,"Sylvester Stallone, Rod Steiger, Peter Boyle, Melinda Dillon",A rebellious Cleveland warehouse worker rises through the ranks of a trucking industry union to become union president but his organized crime links cause his eventual downfall.,https://upmovies.net/watch/RGb004vY-f-i-s-t.html,https://eplayvid.net/watch/901ea027793cb76,
13,https://cdn.upmovies.net/MV5BY2E2ZmVkYjktMTA3Ni00YjhmLWFlYTAtOTg1YmRjNTNmM2YzXkEyXkFqcGdeQXVyNzg5OTk2OA@@._V1_SX300.jpg,Pink U.f.o.,"Animation, Short, Comedy, Family, Sci-Fi",United States,David Detiege,6 min,1978.0,,"A tiny insect-like UFO, armed with a ray that makes everything disappear, flies to Earth. The butterfly-collecting Pink Panther catches it, believing it to be a butterfly. When the UFO gets...",https://upmovies.net/watch/qvaqAYzv-pink-u-f-o.html,https://eplayvid.net/watch/fbf4ebbbecf64ed,
14,https://cdn.upmovies.net/MV5BMjAzODgzNTg0MV5BMl5BanBnXkFtZTcwNzUwOTI0MQ@@._V1_SX300.jpg,The F.j. Holden,Drama,Australia,Michael Thornhill,101 min,1977.0,"Paul Couzens, Carl Stever, Gary Waddell, Karlene Rogerson","Bankstown, NSW, Australia, 1970s. Kevin and his mate Bob spend their time drinking and cruising around the western suburbs of Sydney in Kevin's yellow FJ Holden, looking for girls. One day ...",https://upmovies.net/watch/rdm6BjvX-the-f-j-holden.html,https://eplayvid.net/watch/3468418078d4b6a,
15,https://cdn.upmovies.net/MV5BNTQ4NGNkNDEtZmNhNS00MWY2LTk0MzQtYjVlZjNlZDVmZGNhXkEyXkFqcGdeQXVyMTEzNzczMA@@._V1_SX300.jpg,Overlords Of The U.f.o.,Documentary,United States,G. Brook Stanford,94 min,1976.0,"W. Gordon Allen, Trevor James Constable, Juan Fava","This documentary puts forth the theory that UFOs are actually beings from another dimension, and reviews past incidents of UFO sightings in support of that theory.",https://upmovies.net/watch/LxRlKQod-overlords-of-the-u-f-o.html,https://eplayvid.net/watch/8ebdc04fbbbd729,
16,https://cdn.upmovies.net/MV5BNjVjNjczOGQtNjZkNC00ZDdhLWI1ZmEtNDM4MDA3YTM5NWY4XkEyXkFqcGdeQXVyMjcyMDU4NA@@._V1_SX300.jpg,"The F.b.i. Story: The Fbi Versus Alvin Karpis, Public Enemy Number One",Drama,United States,Marvin J. Chomsky,100 min,1974.0,"Robert Foxworth, David Wayne, Kay Lenz, Gary Lockwood",J. Edgar Hoover and the FBI go after notorious bank robber and kidnapper Alvin Karpis and his gang.,https://upmovies.net/watch/JdArL7wv-the-f-b-i-story-the-fbi-versus-alvin-karpis-public-enemy-number-one.html,https://eplayvid.net/watch/1b4e76c5f24837a,
17,https://cdn.upmovies.net/MV5BZGM5OGQwODYtZDEyNS00MTA2LWJiYTgtNGIxZWM2YWMzNGQzXkEyXkFqcGdeQXVyNjc0MzMzNjA@._V1_SX300.jpg,B.f.'s Daughter,"Drama, Romance",United States,Robert Z. Leonard,108 min,1948.0,"Barbara Stanwyck, Van Heflin, Charles Coburn",Wealthy Polly Fulton marries a progressive scholar whose attitudes toward capitalism and acquired wealth puts their marriage in jeopardy.,https://upmovies.net/watch/qd7lzyBv-b-f-s-daughter.html,https://eplayvid.net/watch/0b581754df47900,
18,https://cdn.upmovies.net/MV5BNmM5MDUzMTAtNGYzZi00Y2Y5LTg4MTUtNWE0ODRlMWUzZDVkXkEyXkFqcGdeQXVyNjUzNzQ4NDQ@._V1_SX300.jpg,"John F. Kennedy: Years Of Lightning, Day Of Drums",Documentary,United States,Bruce Herschensohn,85 min,1965.0,"Gregory Peck, Maximilian Schell, Claus Toksvig",John F. Kennedy's years as president.,https://upmovies.net/watch/PGpDjKPG-john-f-kennedy-years-of-lightning-day-of-drums.html,https://eplayvid.net/watch/be0f4eeef7d79f4,
19,https://cdn.upmovies.net/MV5BMjIwNTc5NTc2M15BMl5BanBnXkFtZTcwMTkxMDYyMQ@@._V1_SX300.jpg,F. Scott Fitzgerald And 'the Last Of The Belles',"Biography, Drama, Romance",United States,George Schaefer,98 min,1974.0,"Richard Chamberlain, Blythe Danner, Susan Sarandon, David Huffman",A semi-fictional account of how writer F. Scott Fitzgerald met his wife while he was in the army and stationed in Alabama in 1919.,https://upmovies.net/watch/RGbgmVYd-f-scott-fitzgerald-and-the-last-of-the-belles.html,https://mixdrop21.net/e/1v8pwl8db9wg7q,
20,https://cdn.upmovies.net/A,R.a.f.,Documentary,United Kingdom,John Betts,50 min,1935.0,W. Helmore,Documentary about the Royal Air Force featuring training of new recruits and aircraft of the 1930s.,https://upmovies.net/watch/oxQDE1Bv-r-a-f.html,https://eplayvid.net/watch/ddf528e016176db,
21,https://cdn.upmovies.net/MV5BOTU4ODg1OWEtZjBlYS00MzI0LWJhYWUtMWVhZjEzODY0ZmNmL2ltYWdlL2ltYWdlXkEyXkFqcGdeQXVyMjUxODE0MDY@._V1_SX300.jpg,F. P. 1 Doesn't Answer,"Fantasy, Sci-Fi","United Kingdom, France, Germany",Karl Hartl,74 min,1932.0,"Conrad Veidt, Jill Esmond, Leslie Fenton","(1932) Conrad Veldt, Jill Esmond, Leslie Fenton. Right out of Amazing Stories. A gigantic floating platform is built in the mid-Atlantic for use as a oceanic airport. However, its destruction seems imminent at the hands of foreign sa",https://upmovies.net/watch/RGbgZ5zd-f-p-1-doesn-t-answer.html,https://voe.sx/e/l9ldenhtzty5,
22,https://cdn.upmovies.net/MV5BMjk0ZWIyM2ItZjU4ZC00OGJjLTk1N2ItNzgxOGIxZjQxYWI1L2ltYWdlL2ltYWdlXkEyXkFqcGdeQXVyNjQzNDI3NzY@._V1_SX300.jpg,A Yank In The R.a.f.,"Action, Adventure, Drama",United States,Henry King,98 min,1941.0,"Tyrone Power, Betty Grable, John Sutton, Reginald Gardiner",An American pilot impulsively joins Her Majesty's Royal Air Force in Britain in an attempt to impress his ex-girlfriend.,https://upmovies.net/watch/wvnZQ8Wv-a-yank-in-the-r-a-f.html,https://mixdrop21.net/e/vne63v90sq3rkp,
23,https://cdn.upmovies.net/97gEWqC.jpg,F(x) Koala,Variety show,South Korea,,,,,,https://upmovies.net/watch/yGDnLwv6-f-x-koala.html,https://eplayvid.net/watch/4c29846ed51101d,"https://eplayvid.net/watch/4c29846ed51101d, https://eplayvid.net/watch/e752ee2e31ff47b, https://eplayvid.net/watch/8f46c8cb00032a4, https://eplayvid.net/watch/b439a535f38e36e, https://eplayvid.net/watch/a3332e2af60b94d, https://eplayvid.net/watch/e67d1281bbfb774, https://eplayvid.net/watch/6592381be6de545, https://eplayvid.net/watch/ff38df5d284978b, https://eplayvid.net/watch/d763367afffc843, https://eplayvid.net/watch/ce7a0769033a9bf, https://eplayvid.net/watch/fc75147661050a3, https://eplayvid.net/watch/276915246318387, https://eplayvid.net/watch/4e7c93c5a2a86ec, https://eplayvid.net/watch/fae2cd73bee4fb3, https://eplayvid.net/watch/1d7e6105457ff98"
