Poster URL,Title,Genres,Country,Director,Duration,Year,Actors,Description
https://cdn.upmovies.net/JYLULSB.jpg,D-day (drama),Drama,South Korea,,,2015,,"When a natural disaster strikes Seoul, a team of medical doctors and emergency personnel struggle to deal with its aftermath and help save the victims who suffered from the disaster."
https://cdn.upmovies.net/MV5BZmYxY2U5YjItMzFmYy00NTEzLTkxODMtNjFkMDZkYTUzMDMwXkEyXkFqcGdeQXVyNTM2MDEzNTg@._V1_SX300.jpg,D-frag! (sub),"Animation, Comedy",Japan,N/A,N/A,2014–,"Jamie Marchi, Sam Swanson",A high-school delinquent is shanghaied into joining a game development club by four not-so-normal girls.
https://cdn.upmovies.net/JJDRSSd.jpg,Chicago P.d: Season 2,"Action, Drama",United States,,60 min,2014,"Jason Beghe, Jon Seda, Sophia Bush","Follows District 21 of the Chicago Police Department, which is made up of two distinctly different groups: the uniformed cops and the Intelligence Unit."
https://cdn.upmovies.net/JJDRSSd.jpg,Chicago P.d: Season 1,"Action, Drama",United States,,60 min,2014,"Jason Beghe, Jon Seda, Sophia Bush","Follows District 21 of the Chicago Police Department, which is made up of two distinctly different groups: the uniformed cops and the Intelligence Unit."
https://cdn.upmovies.net/MV5BMTUzODI0NDYwNF5BMl5BanBnXkFtZTgwNTU5OTk1MjE@._V1_SX300.jpg,D-day: Normandy 1944,"Documentary, Short, Family, History",France,Pascal Vuong,43 min,2014,"Tom Brokaw, François Cluzet, Glynis Loizeau","Allied forces invade Normandy on June 6, 1944."
https://cdn.upmovies.net/py2OjjJ.png,Manzo'd With Children: Season 2,Reality-TV,United States,,,2014–,"Albert Manzo, Caroline Manzo","After five seasons on The Real Housewives of New Jersey, Caroline Manzo was ready to leave the crazy drama behind for more family friendly fare. Enter spin-off, Manzo'd with Children, where viewers can get a weekly, more in-depth look at the Manzo family and Caroline's role as Manzo matriarch."
https://cdn.upmovies.net/the-science-of-d-day-2014-67153.jpg,The Science Of D-day,"Documentary, War",United Kingdom,Richard Townsend,30 min,2014,"Rob Bell, David Willey, Jonathan Pearson, Cecil Newton",N/A
https://cdn.upmovies.net/iuS0c7K.jpg,Barry'd Treasure: Season 1,Reality-TV,United States,,,2014,"Barry Weiss, Kentuckyana Jones",Storage Wars Barry Weiss travels around the United States with a few former sidekicks to find rare antiques and collectibles.
https://cdn.upmovies.net/MV5BZmYxY2U5YjItMzFmYy00NTEzLTkxODMtNjFkMDZkYTUzMDMwXkEyXkFqcGdeQXVyNTM2MDEzNTg@._V1_SX300.jpg,D-frag! (dub),"Animation, Comedy",Japan,N/A,N/A,2014–,"Jamie Marchi, Sam Swanson",A high-school delinquent is shanghaied into joining a game development club by four not-so-normal girls.
https://cdn.upmovies.net/MV5BMTY1NzUxNzE3NV5BMl5BanBnXkFtZTgwMDM4MDgwMTE@._V1_SX300.jpg,R.a.d.i.c.a.l.s,"Action, Adventure, Family",United States,Berenika Maciejewicz,80 min,2014,"Michela Crayton, Keith Nagel, Adia Dinh, Tim Taylor",Eight kids develop their natural talents to superhero levels to confront a comic-book-inspired villain kidnapping neighborhood dogs to pull off the crime of the century.
https://cdn.upmovies.net/D0EVh9l.jpg,D-day 360,Documentary,United States,,59 min,2014,,
https://cdn.upmovies.net/MV5BYTcwZGNhOTEtYTJiOC00MGU3LWIzNzAtMzVlYjUxOGFjODBlXkEyXkFqcGdeQXVyNzI2MzA2OTE@._V1_SX300.jpg,D-frag! Ova,"Animation, Comedy",N/A,N/A,N/A,2014,"Shizuka Itô, Katsuyuki Konishi, Chiwa Saitô, Mikako Takahashi",N/A
https://cdn.upmovies.net/MV5BMjE3NDI2NDYyMV5BMl5BanBnXkFtZTgwODc4ODE0NDE@._V1_SX300.jpg,D.l. Hughley: Clear,Comedy,United States,Jay Chapman,60 min,2014,D.L. Hughley,"D.L. Hughley takes the stage at the Regency Ballroom in San Francisco for his new stand up special. In this uproarious performance, Hughley riffs on everything from the value of having nosy white neighbors to Colorado legalizing marijuana."
https://cdn.upmovies.net/oQ67XXR.jpg,Manzo'd With Children: Season 1,Reality-TV,United States,,,2014–,"Albert Manzo, Caroline Manzo",
https://cdn.upmovies.net/MV5BMjE1MDM4ODkxMF5BMl5BanBnXkFtZTgwNzM3NjQxMjE@._V1_SX300.jpg,Bigfoot Vs. D.b. Cooper,Horror,United States,David DeCoteau,77 min,2014,"Liam Watkins, D.J. Aiken, Kyle George, Keith Metcalf",When several young hunters arrive at a secluded lodge in the Pacific Northwest little do they know that they will become the hunted.
https://cdn.upmovies.net/MV5BNzk0MTQ4MzI5Ml5BMl5BanBnXkFtZTgwNjc4NTc5MzE@._V1_SX300.jpg,Manzo'd With Children: Season 3,Reality-TV,United States,N/A,N/A,2014–,"Albert Manzo, Albie Manzo, Caroline Manzo, Chris Manzo","After five seasons on The Real Housewives of New Jersey, Caroline Manzo was ready to leave the crazy drama behind for more family friendly fare. Enter spin-off, Manzo'd with Children, where viewers can get a weekly, more in-depth look at the Manzo family and Caroline's role as Manzo matriarch."
https://cdn.upmovies.net/MV5BMTU4NTA3MDI0Ml5BMl5BanBnXkFtZTgwMjg0NDE3MjE@._V1_SX300.jpg,Bill Maher: Live From D.c.,"Documentary, Comedy",United States,Troy Miller,61 min,2014,"Bill Maher, Patrick Moran Donovan, Michael Moore, Gale Nemec","In this special with Bill Maher, the political commentator and satirist discusses midterm elections, income inequality, the Republican psyche, a Trump lawsuit, why the Pope is an atheist and why tattoos are stupid."
https://cdn.upmovies.net/MV5BZWViYmIzNTktNzFlNi00MmI4LWFiZjItMTJkMzg0NTBkODY5XkEyXkFqcGdeQXVyNTM3MDMyMDQ@._V1_SX300.jpg,D-day: Hidden Traces,"Documentary, History, War",United States,N/A,54 min,2014,"Laurent Dujardin, Emmanuel Ghesquière, Benoît Labbey, Ludovic Le Gaillard","D-Day - June 6th 1944 : Uncovered by recent archeological digs, traces left behind by soldiers and civilians on the battle ground such as helmets, badges, bullets, weapons, and cans plus ..."
https://cdn.upmovies.net/uYhITti.jpg,Agents Of S.h.i.e.l.d.: Season 2,"Action, Drama, Sci-Fi",United States,,,2014," Clark Gregg, Ming-Na Wen, Brett Dalton","The missions of the Strategic Homeland Intervention, Enforcement and Logistics Division..."
https://cdn.upmovies.net/7ON80ek.jpg,D-frag!,"Animation, Comedy, Anime",Japan,,,2014,"Shizuka Itô, Katsuyuki Konishi, Chiwa Saito",A high-school delinquent is shanghaied into joining a game development club by four not-so-normal girls.
https://cdn.upmovies.net/7JLd1Zz.jpg,Nail'd It!: Season 1,,,,,2014–,"Teazz Yung, Erin-Elizabeth Miller",
https://cdn.upmovies.net/501774.jpg,Don't Say No Until I Finish Talking: The Story Of Richard D. Zanuck,Documentary Biography,,Laurent Bouzereau,,2013,Virginia Fox Lawrence Gordon Richard D. Zanuck Darryl F. Zanuck,A look at the life and work of legendary film producer Richard D. Zanuck.
https://cdn.upmovies.net/MV5BMTk0MjE2MzI0Nl5BMl5BanBnXkFtZTgwNzc0MzAxMzE@._V1_SX300.jpg,I'd Kill For You: Season 3,"Crime, Drama",United States,N/A,N/A,2013–,Quinton Flynn,N/A
https://cdn.upmovies.net/LqZ8krY.jpg,I'd Kill For You: Season 2,"Crime, Drama",United States,,,2013–,"Harry L. Seddon, Ryan Jennifer, Kevin Cusick","lifts the lid on unbelievable crimes in which one human's love is chosen over another's life. These pre-meditated, highly calculated killings were all orchestrated by a twisted manipulator who used their love as the ultimate murder weapon."
https://cdn.upmovies.net/LZFl4Nu.jpg,Nurse 3-d,Thriller,United States,Douglas Aarniokoski,84 min,2013,"Paz de la Huerta, Katrina Bowden, Judd Nelson","By day Abby Russell is a dedicated nurse, someone you wouldn't hesitate to trust your life with. But by night, her real work begins...using her smoldering sexuality she lures cheating men to their brutal deaths and exposes them for who they really are. When a younger nurse starts to suspect Abby's actions and compromises her master plan, Abby must find a way to outsmart her long enough to bring the cheater you'd least expect to justice..."
https://cdn.upmovies.net/HaButiQ.jpg,W.m.d.,"Action, Thriller, War",United States,Richard Halpern,81 min,2013,"Tom Kiesche, John Posey, Weetus Cren",The Iraq war has turned from 'Mission Accomplished' into a hellhole with an indeterminate outcome. There are no WMDs. No links to Al Qaeda. No imminent threat as promised by the ...
https://cdn.upmovies.net/DzCFyP1.jpg,D-day,"Action, Thriller",India,Nikhil Advani,153 min,2013,"Irrfan Khan, Rishi Kapoor, Arjun Rampal","9 years ago Wali Khan (Irrfan Khan) was sent into Karachi, Pakistan by the Chief of RAW Ashwini Rao (Nasser) to report the activities of The Most Wanted Man in India. 9 days ago Rudra Pratap Singh (Arjun Rampal) Indian Armed Forces, MARCOS unit, Zoya Rehman (Huma Qureshi) RAW Explosives expert, and Aslam, a petty thief from the streets of Mumbai recruited by RAW, infiltrated Pakistan to join Wali Khan and carry out the mission to bring back The Most Wanted Man in India. The man who was going to break all ISI protocol and security and attend his own son's wedding. The man who could on that day be abducted and brought back to India to face justice. 1 day ago everything went according to plan until it all failed. The team sent in to bring The Most Wanted Man in India, did the unthinkable - they carried out the most daring operation and almost got away with it. Almost because, something went horribly wrong..."
https://cdn.upmovies.net/8sxFMfv.jpg,A.c.o.d.,Comedy,United States,Stu Zicherman       (as Stuart Zicherman),88 min,2013,"Adam Scott, Richard Jenkins, Catherine O'Hara",A.C.O.D. follows a seemingly well-adjusted Adult Child of Divorce (Adam Scott) who is forced to revisit the chaos of his parents' (Catherine O'Hara and Richard Jenkins) bitter divorce all over again after his younger brother (Clark Duke) decides to get married...
https://cdn.upmovies.net/LqZ8krY.jpg,I'd Kill For You: Season 1,"Crime, Drama",United States,,,2013–,"Harry L. Seddon, Ryan Jennifer, Kevin Cusick","lifts the lid on unbelievable crimes in which one human's love is chosen over another's life. These pre-meditated, highly calculated killings were all orchestrated by a twisted manipulator who used their love as the ultimate murder weapon."
